{
  "schema_version": 1,
  "video_id": "2026-05-26_anti_drone_platform_biranit",
  "scene_id": "2026-05-26_anti_drone_platform_biranit_seg04_seg05",
  "path": "2026-05-26_anti_drone_platform_biranit/2026-05-26_anti_drone_platform_biranit_seg04_seg05",
  "viewer_key": "scenes/2026-05-26_anti_drone_platform_biranit/2026-05-26_anti_drone_platform_biranit_seg04_seg05/viewer/scene_meta.json"
}
