{
  "schema_version": 1,
  "video_id": "2026-05-18_brigade_300_commander_vehicle_shomera_mmirleb_16516",
  "scene_id": "2026-05-18_brigade_300_commander_vehicle_shomera_mmirleb_16516_seg04",
  "path": "2026-05-18_brigade_300_commander_vehicle_shomera_mmirleb_16516/2026-05-18_brigade_300_commander_vehicle_shomera_mmirleb_16516_seg04",
  "viewer_key": "scenes/2026-05-18_brigade_300_commander_vehicle_shomera_mmirleb_16516/2026-05-18_brigade_300_commander_vehicle_shomera_mmirleb_16516_seg04/viewer/scene_meta.json"
}
