{
  "schema_version": 1,
  "video_id": "2026-05-01_merkava_tank_rashaf_mmirleb_15950",
  "scene_id": "2026-05-01_merkava_tank_rashaf_mmirleb_15950_seg02_seg03",
  "path": "2026-05-01_merkava_tank_rashaf_mmirleb_15950/2026-05-01_merkava_tank_rashaf_mmirleb_15950_seg02_seg03",
  "viewer_key": "scenes/2026-05-01_merkava_tank_rashaf_mmirleb_15950/2026-05-01_merkava_tank_rashaf_mmirleb_15950_seg02_seg03/viewer/scene_meta.json"
}
