{
  "schema_version": 1,
  "video_id": "2026-04-29_strike_on_merkava_tank",
  "scene_id": "2026-04-29_strike_on_merkava_tank_seg01",
  "path": "2026-04-29_strike_on_merkava_tank/2026-04-29_strike_on_merkava_tank_seg01",
  "viewer_key": "scenes/2026-04-29_strike_on_merkava_tank/2026-04-29_strike_on_merkava_tank_seg01/viewer/scene_meta.json"
}
