{
  "schema_version": 1,
  "video_id": "2026-05-27_merkava_tank_on_military_route",
  "scene_id": "2026-05-27_merkava_tank_on_military_route_seg01",
  "path": "2026-05-27_merkava_tank_on_military_route/2026-05-27_merkava_tank_on_military_route_seg01",
  "viewer_key": "scenes/2026-05-27_merkava_tank_on_military_route/2026-05-27_merkava_tank_on_military_route_seg01/viewer/scene_meta.json"
}
