{
  "schema_version": 1,
  "video_id": "2026-05-30_technical_equipment_rashaf_mmirleb_17060",
  "scene_id": "2026-05-30_technical_equipment_rashaf_mmirleb_17060_seg01_seg02",
  "path": "2026-05-30_technical_equipment_rashaf_mmirleb_17060/2026-05-30_technical_equipment_rashaf_mmirleb_17060_seg01_seg02",
  "viewer_key": "scenes/2026-05-30_technical_equipment_rashaf_mmirleb_17060/2026-05-30_technical_equipment_rashaf_mmirleb_17060_seg01_seg02/viewer/scene_meta.json"
}
