{
  "schema_version": 1,
  "video_id": "2026-06-13_excavator_majdal_zoun",
  "scene_id": "2026-06-13_excavator_majdal_zoun_seg02_seg03",
  "path": "2026-06-13_excavator_majdal_zoun/2026-06-13_excavator_majdal_zoun_seg02_seg03",
  "viewer_key": "scenes/2026-06-13_excavator_majdal_zoun/2026-06-13_excavator_majdal_zoun_seg02_seg03/viewer/scene_meta.json"
}
