{
  "schema_version": 1,
  "video_id": "2026-06-11_merkava_tank_tayr_harfa_ababil_drone",
  "scene_id": "2026-06-11_merkava_tank_tayr_harfa_ababil_drone_seg03",
  "path": "2026-06-11_merkava_tank_tayr_harfa_ababil_drone/2026-06-11_merkava_tank_tayr_harfa_ababil_drone_seg03",
  "viewer_key": "scenes/2026-06-11_merkava_tank_tayr_harfa_ababil_drone/2026-06-11_merkava_tank_tayr_harfa_ababil_drone_seg03/viewer/scene_meta.json"
}
