{
  "schema_version": 1,
  "video_id": "2026-05-30_merkava_tank_in_border_area",
  "scene_id": "2026-05-30_merkava_tank_in_border_area_seg02_seg03",
  "path": "2026-05-30_merkava_tank_in_border_area/2026-05-30_merkava_tank_in_border_area_seg02_seg03",
  "viewer_key": "scenes/2026-05-30_merkava_tank_in_border_area/2026-05-30_merkava_tank_in_border_area_seg02_seg03/viewer/scene_meta.json"
}
