{
  "schema_version": 1,
  "video_id": "2026-06-04_merkava_tank_beaufort_castle",
  "scene_id": "2026-06-04_merkava_tank_beaufort_castle_seg02_seg03",
  "path": "2026-06-04_merkava_tank_beaufort_castle/2026-06-04_merkava_tank_beaufort_castle_seg02_seg03",
  "viewer_key": "scenes/2026-06-04_merkava_tank_beaufort_castle/2026-06-04_merkava_tank_beaufort_castle_seg02_seg03/viewer/scene_meta.json"
}
