{
  "schema_version": 1,
  "video_id": "2026-06-11_israeli_soldiers_adaissah_mmirleb_17602",
  "scene_id": "2026-06-11_israeli_soldiers_adaissah_mmirleb_17602_seg01_seg02",
  "path": "2026-06-11_israeli_soldiers_adaissah_mmirleb_17602/2026-06-11_israeli_soldiers_adaissah_mmirleb_17602_seg01_seg02",
  "viewer_key": "scenes/2026-06-11_israeli_soldiers_adaissah_mmirleb_17602/2026-06-11_israeli_soldiers_adaissah_mmirleb_17602_seg01_seg02/viewer/scene_meta.json"
}
