{
  "schema_version": 1,
  "video_id": "2026-06-11_d9_engineering_vehicle_beaufort_castle_mmirleb_17598",
  "scene_id": "2026-06-11_d9_engineering_vehicle_beaufort_castle_mmirleb_17598_seg03_seg04",
  "path": "2026-06-11_d9_engineering_vehicle_beaufort_castle_mmirleb_17598/2026-06-11_d9_engineering_vehicle_beaufort_castle_mmirleb_17598_seg03_seg04",
  "viewer_key": "scenes/2026-06-11_d9_engineering_vehicle_beaufort_castle_mmirleb_17598/2026-06-11_d9_engineering_vehicle_beaufort_castle_mmirleb_17598_seg03_seg04/viewer/scene_meta.json"
}
