{
  "schema_version": 1,
  "video_id": "2026-05-28_merkava_tank_zawtar_al_sharqiyah_mmirleb_17154",
  "scene_id": "2026-05-28_merkava_tank_zawtar_al_sharqiyah_mmirleb_17154_seg02_seg03_seg04_seg05",
  "path": "2026-05-28_merkava_tank_zawtar_al_sharqiyah_mmirleb_17154/2026-05-28_merkava_tank_zawtar_al_sharqiyah_mmirleb_17154_seg02_seg03_seg04_seg05",
  "viewer_key": "scenes/2026-05-28_merkava_tank_zawtar_al_sharqiyah_mmirleb_17154/2026-05-28_merkava_tank_zawtar_al_sharqiyah_mmirleb_17154_seg02_seg03_seg04_seg05/viewer/scene_meta.json"
}
