{
  "schema_version": 1,
  "video_id": "2026-06-14_engineering_vehicle_arnoun_ababil_drone",
  "scene_id": "2026-06-14_engineering_vehicle_arnoun_ababil_drone_seg02_seg03",
  "path": "2026-06-14_engineering_vehicle_arnoun_ababil_drone/2026-06-14_engineering_vehicle_arnoun_ababil_drone_seg02_seg03",
  "viewer_key": "scenes/2026-06-14_engineering_vehicle_arnoun_ababil_drone/2026-06-14_engineering_vehicle_arnoun_ababil_drone_seg02_seg03/viewer/scene_meta.json"
}
