{
  "schema_version": 1,
  "video_id": "2026-06-03_humvee_zawtar_al_sharqiyah",
  "scene_id": "2026-06-03_humvee_zawtar_al_sharqiyah_seg03_seg04",
  "path": "2026-06-03_humvee_zawtar_al_sharqiyah/2026-06-03_humvee_zawtar_al_sharqiyah_seg03_seg04",
  "viewer_key": "scenes/2026-06-03_humvee_zawtar_al_sharqiyah/2026-06-03_humvee_zawtar_al_sharqiyah_seg03_seg04/viewer/scene_meta.json"
}
