{
  "schema_version": 1,
  "video_id": "2026-04-24_d9_engineering_vehicle_between_taybeh_and_deir_siryan",
  "scene_id": "2026-04-24_d9_engineering_vehicle_between_taybeh_and_deir_siryan_seg01",
  "path": "2026-04-24_d9_engineering_vehicle_between_taybeh_and_deir_siryan/2026-04-24_d9_engineering_vehicle_between_taybeh_and_deir_siryan_seg01",
  "viewer_key": "scenes/2026-04-24_d9_engineering_vehicle_between_taybeh_and_deir_siryan/2026-04-24_d9_engineering_vehicle_between_taybeh_and_deir_siryan_seg01/viewer/scene_meta.json"
}
