{
  "schema_version": 1,
  "video_id": "2026-06-12_merkava_tank_yahmor_al_shqif",
  "scene_id": "2026-06-12_merkava_tank_yahmor_al_shqif_seg02",
  "path": "2026-06-12_merkava_tank_yahmor_al_shqif/2026-06-12_merkava_tank_yahmor_al_shqif_seg02",
  "viewer_key": "scenes/2026-06-12_merkava_tank_yahmor_al_shqif/2026-06-12_merkava_tank_yahmor_al_shqif_seg02/viewer/scene_meta.json"
}
