{
  "schema_version": 1,
  "video_id": "2026-05-04_hemtt_logistics_vehicle_manara_mmirleb_16528",
  "scene_id": "2026-05-04_hemtt_logistics_vehicle_manara_mmirleb_16528_seg01",
  "path": "2026-05-04_hemtt_logistics_vehicle_manara_mmirleb_16528/2026-05-04_hemtt_logistics_vehicle_manara_mmirleb_16528_seg01",
  "viewer_key": "scenes/2026-05-04_hemtt_logistics_vehicle_manara_mmirleb_16528/2026-05-04_hemtt_logistics_vehicle_manara_mmirleb_16528_seg01/viewer/scene_meta.json"
}
