{
  "schema_version": 1,
  "video_id": "2026-06-12_merkava_tank_beaufort_castle_mmirleb_17595",
  "scene_id": "2026-06-12_merkava_tank_beaufort_castle_mmirleb_17595_seg03",
  "path": "2026-06-12_merkava_tank_beaufort_castle_mmirleb_17595/2026-06-12_merkava_tank_beaufort_castle_mmirleb_17595_seg03",
  "viewer_key": "scenes/2026-06-12_merkava_tank_beaufort_castle_mmirleb_17595/2026-06-12_merkava_tank_beaufort_castle_mmirleb_17595_seg03/viewer/scene_meta.json"
}
