{
  "schema_version": 1,
  "video_id": "2026-06-13_logistics_position_bayyadah_mmirleb_17434",
  "scene_id": "2026-06-13_logistics_position_bayyadah_mmirleb_17434_seg03_seg04",
  "path": "2026-06-13_logistics_position_bayyadah_mmirleb_17434/2026-06-13_logistics_position_bayyadah_mmirleb_17434_seg03_seg04",
  "viewer_key": "scenes/2026-06-13_logistics_position_bayyadah_mmirleb_17434/2026-06-13_logistics_position_bayyadah_mmirleb_17434_seg03_seg04/viewer/scene_meta.json"
}
