{
  "schema_version": 1,
  "video_id": "2026-05-27_enemy_vehicle_in_northern_settlement",
  "scene_id": "2026-05-27_enemy_vehicle_in_northern_settlement_seg02_seg03",
  "path": "2026-05-27_enemy_vehicle_in_northern_settlement/2026-05-27_enemy_vehicle_in_northern_settlement_seg02_seg03",
  "viewer_key": "scenes/2026-05-27_enemy_vehicle_in_northern_settlement/2026-05-27_enemy_vehicle_in_northern_settlement_seg02_seg03/viewer/scene_meta.json"
}
