{
  "schema_version": 1,
  "video_id": "2026-06-10_humvee_yahmar_al_shaqif",
  "scene_id": "2026-06-10_humvee_yahmar_al_shaqif_seg02_seg03",
  "path": "2026-06-10_humvee_yahmar_al_shaqif/2026-06-10_humvee_yahmar_al_shaqif_seg02_seg03",
  "viewer_key": "scenes/2026-06-10_humvee_yahmar_al_shaqif/2026-06-10_humvee_yahmar_al_shaqif_seg02_seg03/viewer/scene_meta.json"
}
