{
  "schema_version": 1,
  "video_id": "2026-05-24_humvee_manara_mmirleb_16823",
  "scene_id": "2026-05-24_humvee_manara_mmirleb_16823_seg02_seg03",
  "path": "2026-05-24_humvee_manara_mmirleb_16823/2026-05-24_humvee_manara_mmirleb_16823_seg02_seg03",
  "viewer_key": "scenes/2026-05-24_humvee_manara_mmirleb_16823/2026-05-24_humvee_manara_mmirleb_16823_seg02_seg03/viewer/scene_meta.json"
}
